University;Faculty;Qulification;Year;Modules;Module Code;SAQA credits;Description
null;null;null;null;Clinical Veterinary Technology III in Molecular Biology*;MCB307P;24;This course covers molecular and cell biology at the cellular and organisimal levels.
null;null;null;null;Clinical Veterinary Technology III in Protozoology*;PZY307P;18;This course is designed to help veterinary technicians gain insight and understanding into normal animal behavior.
null;null;null;null;Research Principles III;RPV307P;6;The course introduces the language of research, ethical principles and challenges, and the elements of the research process within quantitative and qualitative
null;null;null;null;Clinical Veterinary Technology III in Virology*;VLY307P;18;This short course will cover principles of virus-host interactions and pathobiology with respect to human and animal viruses
null;null;null;null;Clinical Veterinary Technology III in Veterinary Microbiology*;VRM307P;18;Practical application of the theoretical aspects of small animal, production animal, equine and state veterinary practice covered in the core curriculum
null;null;null;4;Clinical Veterinary Technology IV in Bacteriology*;BTY408P;24;Develops the knowledge and skills necessary to perform microbiology assays in a veterinary laboratory.
null;null;null;null;Laboratory Management IV*;LBT418P;12;The purpose of the program is to provide the learner with knowledge and understanding of the fundamental management skills, behaviour and attitudes required
null;null;null;null;Clinical Veterinary Technology IV in Molecular Biology*;MCB408P;24;You will learn how molecules such as DNA, RNA, and proteins influence the fundamental processes of cellular life.
null;null;null;null;Clinical Veterinary Technology IV in Parasitology*;PAR408P;24;Large Animal Parasitology provides students with a foundation in parasitology and expand on the fundamentals taught in the core course.
null;null;null;null;Research Principles IV and Project*;RPV408P;30;The course covers research writing modes and methods, studio investigative processes and methodologies, critical thinking.
null;null;null;null;Clinical Veterinary Technology IV in Virology*;VLY408P;24;This module prepares students to acquire in-depth and analysed theoretical knowledge and understanding of the concepts and theories related to specific Single- and Double-stranded RNA, and DNA viruses and their presence in the veterinary environment, as well as the application of knowledge in clinical laboratory practice through a structured and managed Work-Integrated Learning programme. Students will gain the ability to select and apply a range of techniques, methods and procedures in order to perform clinical laboratory procedures/tests pertaining to single- and double-stranded RNA, and DNA viruses.
null;null;BACHELOR OF RADIOGRAPHY IN DIAGNOSTIC;1;Chemistry for Health Sciences I;CHS115P;12;This module prepares the student to understand and use fundamental concepts in chemistry. The student will be able to apply his/her knowledge of atomic theory, nomenclature, stoichiometry, chemical equilibrium, organic chemistry and gases and liquids to basic chemistry related problems. Upon completion, the student will be able to discuss fundamental concepts in chemistry and do related calculations
null;null;null;null;Physics for Health Sciences I;PHS115P;12;This module is aimed at enhancing student knowledge in fundamental concepts in mechanics, mechanical properties of fluids, thermal properties of matter, general and geometrical properties of waves, static electricity and electric circuits and their applications thereof
null;null;null;null;Research Principles I;RPH115P;6;This module which prepares the student to demonstrate knowledge of and engagement in the advanced aspects of research principles and techniques at the forefront related to a particular medical field of study or specialisation. Students should further be able to demonstrate understanding of the analysis and interpretation of research results, the structure and composition of a research report, as well as publications and presentations Students will gain knowledge in the use of specialised skills to identify, analyse and address abstract problems related to a research project in a field of study or specialisation, as well as to incorporate body of knowledge and methods during the problem solving process.
null;null;null;2;Clinical Radiographic Practice II;CRP206P;24;This module prepares the student to integrate basic and specialised radiographic knowledge to ultimately become professional, competent radiographers who are able to work in a multi-disciplinary health environment. The student will be able to apply his/her knowledge of Clinical Radiographic Practice within simulated and clinical environments.
null;null;null;null;Human Anatomy II;HAN206P;18;This module builds on prior knowledge of human anatomy and physiology. Upon completion, the student will be able to apply his/her knowledge of cellular components, tissue and organ systems to and overall perspective of a healthy human necessary in the medical community. Upon completion, the student will be able to understand important cellular concepts, identify all bones, muscles, nerves and have a sound basis of each organ system which includes the embryological development of each system. Students will also have mastered the practical skills to be confident in identifying all human body structures and location.
null;null;null;null;Human Physiology II;HPY206P;18;The student should demonstrate detailed knowledge of the human body’s cellular and chemical organisation, the principles of support and movement, the control and maintenance of the human body through the various organ systems, pathophysiology of organ systems and continuity contributing to their understanding of the physiology of a healthy human body. Upon completion, the student will be able to identify, explain and apply concepts and principles of organisation of the human body, control-, maintenance-, and pathophysiology of organ systems, sensory organs and continuity to the extent that they are able to successfully undertake various discipline specific modules related to human physiology. Students will also have the practical skills to be confident in all human body functions and their roles and apply this knowledge in a clinical setting. (
null;null;null;null;Radiographic Imaging II;RDI206P;18;This module prepares the student to apply, integrate, and demonstrate basic knowledge, skills and applicable attitudes to a range of advanced imaging modalities and associated advanced technology in the field of Diagnostic Radiography, to be able to understand the process of image formation at this level and also required for the student to become a skilled qualified diagnostic radiographer who can work independently in a multidisciplinary health environment.
null;null;null;null;Radiation Physics, Protection and Diagnostic Imaging Equipment II;RDQ206P;24;This module enables the student to apply his/her knowledge to recall and demonstrate an understanding of the major learning fields of general physics, radiation physics, electricity, basic physics of ultrasound, basic physics of MRI, physics of radiography and radiation safety and protection.
null;null;null;null;Radiographic Practice II;RPT206P;24;"This module prepares the student to demonstrate detailed radiographic knowledge of radiation effects and protection; specialised radiographic technique of the axial skeleton, appendicular skeleton and body systems; fluoroscopic principles; contrast medium administration and the emergency procedure; contrast medium examinations; mobile and intraoperative examinations; obstetrics and gynaecological imaging and soft tissue radiography and in so doing ultimately become professional, competent radiographers who are able to work in a multi-disciplinary health environment. The student will be able to apply his/her knowledge of Radiographic Practice within simulated and familiar clinical environments."
null;null;null;null;Radiographic Pathology II;RPY206P;18;This module prepares the student to acquire integrated knowledge of a wide range of pathologies with associated radiographic patterns, as found in the Cardiovascular-, Nervous-,Endocrine-, Reproductive- and Hematopoietic Systems. Furthermore, the student will acquire integrated knowledge of specific internal devices. This forms a knowledge base which intends to promote the student’s understanding of diseases found in abovementioned systems that patients suffer from. The student will be able to apply his/her knowledge of Radiographic Pathology in the field of Diagnostic Radiography. (
null;null;null;null;Research Principles II;RPH216P;6;This module prepares the student to demonstrate detailed understanding and knowledge of the main areas of research principles and the ability to apply concepts, principles and theories related to the framework of a research proposal, the different research methodologies and designs, as well as data collection principles, analysis, reliability, validity, rigour, trustworthiness, budget and funding. Through this module, the student will demonstrate understanding of the research problem and objectives within the context of a particular research methodology, as well as the ability to evaluate, select and apply the optimal sampling procedures, data collection principles relevant to a research methodology and design. Knowledge and the ability to analyse, synthesise, and evaluate information from different sources of scholarly academic information, including definitions, criteria, purposes, questionnaire designs, data collection principles and methods for the application during the research process will be obtained in preparation to the next level of research principles and procedures to follow
null;null;null;3;Clinical Radiographic Practice III;CRP307P;24;"This module prepares the student to integrate, demonstrate and apply specialised radiographic knowledge
and skills to ultimately become professional, competent radiographers who are able to work in a multi-disciplinary health environment. The student will be able to apply his/her integrated and applied knowledge
of Anatomy, Physiology, Advanced Pathology, Pattern Recognition, Imaging, basic research and computer
literacy within clinical radiography environment. This module is a clinical orientated theory and WIL integrated
module with the emphases mainly on Workplace-based learning. "
null;null;null;null;Health Care Administration and Management I;HAM307P;12;In this module, the student will be able to demonstrate integrated knowledge and the application of strategic management processes, different management models, importance and utilization of human resources within a health care environment.
null;null;null;null;Radiographic Imaging III;RDI307P;24;This module prepares the student to apply, integrate, and demonstrate in depth knowledge, skills and applicable attitudes to a range of advanced imaging modalities and associated advanced technology in the field of Diagnostic Radiography, to be able to independently work on the latest developments of technology such as Picture Archiving and Communication system (PACS) as well as Hospital Information Systems (HIS) and Radiology Information System (RIS).
null;null;null;null;Research Principles III;RPH307P;6;This module prepares the student to demonstrate integrated knowledge of the central and crucial areas of research principles and methodologies including the ability to apply concepts, principles and theories necessary for the compilation of a research proposal in the context of an academic and/or health science related environment. Through this module, students will gain understanding of the roles and responsibilities pertaining to the research supervisor and the researcher. Students will learn to differentiate between research methods and their suitability and ability to resolve specific research enquiries, act ethically and professionally with dignity and integrity, as well as to manage the processing of gathered data through advanced bio-statistical methods.
null;null;null;null;Radiographic Practice III;RPT307P;24;This module prepares the student to attain, apply and integrate specialised radiographic knowledge to ultimately become professional, competent radiographers who are able to work in a multi-disciplinary health environment. The student will be able to apply and integrate his/her knowledge of Anatomy, Physiology, Advanced Pathology, Pattern Recognition, basic research and computer literacy, as well as specific knowledge regarding specialised skull radiography, paediatrics. Computerized Tomography (CT) and specialised contrast media procedures such as Sialography, Dacrocystography, Sinography etc. In addition, integrated knowledge regarding other modalities will be obtained including Magnetic Resonance Imaging (MRI), Ultrasound, Nuclear Medicine and Radiation Oncology, as experienced in the clinical radiography environment.
null;null;null;null;Radiographic Pathology III;RPY307P;12;This module prepares the student to acquire integrated knowledge of a wide range of pathologies with associated radiographic patterns, as found in the Cardiovascular-, Nervous-,Endocrine-, Reproductive- and Hematopoietic Systems. Furthermore, the student will acquire integrated knowledge of specific internal devices. This forms a knowledge base which intends to promote the student’s understanding of diseases found in abovementioned systems that patients suffer from. The student will be able to apply his/her knowledge of Radiographic Pathology in the field of Diagnostic Radiography.
null;null;null;null;Sectional Anatomy and Pattern Recognition III;SAP307P;12;This module prepares the student to acquire integrated knowledge of sectional/slice images that demonstrate different regions of the body and a range of abnormal patterns associated with diseases as demonstrated on CT and MRI images. The module will furthermore prepare the student to distinguish between normal and abnormal radiographic patterns associated with disease. The student will be able to apply his/her knowledge of mentioned components of the module in the field of Diagnostic Radiography
null;null;null;null;Specialised Radiographic Imaging Equipment III;SRI307P;18;"This module prepares the student to demonstrate integrated knowledge in the fundamental concepts and functioning of x-ray apparatus used in various specialised diagnostic radiographic imaging modalities: Fluoroscopy, Dentistry, Mammography, Digital Radiography, Digital Tomography, MRI, Ultrasound, Bone Densitometry and Nuclear Medicine. In addition, it seeks to help students develop a conceptual understanding of the diagnostic x-ray imaging components per each modality; develop the ability to reason and compare in an organised manner; this is essential in optimising modalities"
null;null;null;4;Clinical Radiographic Practice IV;CRP408P;12;This module prepares the student to apply, integrate, and demonstrate in depth forefront knowledge, skills and applicable attitudes to a range of advanced imaging modalities and associated advanced technology in the field of Diagnostic Radiography, to be able to authentically perform specified specialised diagnostic examinations and procedures required at this level and also required for the student to become a highly skilled qualified diagnostic radiographer who can work independently in a multi-disciplinary health environment. The student will furthermore be able to apply his/her knowledge of medical law, bioethics and human rights to clinical professional practice, as well as the psycho-dynamics of patient management in a healthcare context. All previously accumulated acquired knowledge, skills and attitudes are being integrated and applied to achieve this level of performance in the clinical practice. This module relates directly to Work-integrated Learning (WIL) with the emphases mainly on Workplace-based learning.
null;null;null;null;Radiographic Imaging IV;RDI408P;12;This module prepares the student to apply, integrate, and demonstrate in depth forefront knowledge, skills and applicable attitudes to a range of advanced imaging modalities and associated advanced technology in the field of Diagnostic Radiography, to be able to operate specified specialised digital radiography equipment required at this level and also required for the student to become a highly skilled and qualified diagnostic radiographer who can work independently in a multi-disciplinary health environment.
null;null;null;null;Research Principles IV and Project;RPH408P;30;This module which prepares the student to demonstrate knowledge of and engagement in the advanced aspects of research principles and techniques at the forefront related to a particular medical field of study or specialisation. Students should further be able to demonstrate understanding of the analysis and interpretation of research results, the structure and composition of a research report, as well as publications and presentations Students will gain knowledge in the use of specialised skills to identify, analyse and address abstract problems related to a research project in a field of study or specialisation, as well as to incorporate body of knowledge and methods during the problem solving process. On completion of this module, students should show their ability to present and communicate scientific research results to a range of audiences in the format of a research article for a given journal, poster design, as well as in the form of a verbal and visual research presentation.
null;null;null;null;Radiographic Practice IV;RPT408P;24;This module prepares the student to acquire, apply, integrate, and demonstrate in depth forefront knowledge of a range of advanced imaging modalities, including Computerized Tomography, Angiography and Interventional Procedures and Ultrasound, as well as associated advanced technology in the field of Diagnostic Radiography, which are required at this level and also required for the student to become a highly skilled qualified diagnostic radiographer who can work independently
null;null;null;null;Sectional Anatomy and Pattern Recognition IV;SAP408P;12;This module prepares the student to acquire, apply, integrate, and demonstrate in depth forefront knowledge of Sectional Anatomy of different regions of the body as demonstrated on CT and MRI images, as well as to recognize abnormal radiographic patterns associated with diseases demonstrated on these images. The module will furthermore prepare the student to acquire, apply, integrate, and demonstrate in depth forefront knowledge of radiographic pattern recognition to distinguish between normal and a wide range of abnormal radiographic patterns associated with a variety of diseases. The student will be able to apply his/her knowledge of mentioned components of the module in the field of Diagnostic Radiography.
null;null;DIPLOMA IN EQUINE SCIENCE;1;Entrepreneurship I;ENT115D;12;Students will acquire knowledge, skills and competence in various types of businesses, management functions, budgeting, accounting, administration, banking, personnel management, customer relations and entrepreneurship including drafting a business plan. These skills will assist entrepreneurs in successfully starting and running a business.
null;null;null;null;Pasture Science I;PAE115D;12;"An informed understanding of natural and planted pastures for the nutrition of farm animals is important in livestock improvement. Students will acquire knowledge, skills and applied competencies in the following areas: Plant morphology, growth and development; Natural pastures; Plant nutrition and fertilisation; Pasture establishment and management; Fodder conservation; Environmental effects; Weeds and poisonous plants; Pasture production systems; applicable Acts and regulations; and how that knowledge relates to other fields, disciplines or practices."
null;null;null;null;Animal Breeding and Genetics I;ABG115D;12;"An informed understanding of the principles of animal breeding and genetics is important for livestock improvement. Students will acquire knowledge, skills and applied competencies in areas such as: basic concepts of animal breeding and genetics, qualitative and quantitative traits of inheritance, population genetics and evolution, selection methods, breeding programmes and mating systems, molecular genetics, Animal Improvement Schemes; applicable Acts and regulations; and how that knowledge relates to other fields, disciplines or practices"
null;null;null;null;Stable Management I;SMA115D;12;"Students are capacitated with a detailed knowledge of equine stable management and horse husbandry principles and practice. Students will acquire knowledge, skills and applied competencies in areas such as: Stable complex design and construction; Equestrian training and riding arenas design and construction; Paddock management and field-kept horses; Modern equine stable management principles and practice; Care of stable-kept horses and organisation of equestrian facilities; Equine and equestrian enterprise administration and record keeping; Equine and equestrian enterprise personnel management; and how that knowledge relates to other fields, disciplines or practices."
null;null;null;2;Equine Nutrition II;EQN216D;12;"Students will acquire knowledge, skills and applied competencies in areas such: Nutritional physiology and body condition scoring; Determination of requirements for protein, energy, carbohydrates, acid and neutral detergent fibre, vitamins and minerals; Nutrient provision: protein, energy, fibre and raw material processing; Commercial rations/simple ration formulation and calculation; Feeding management responses: rates of passage, glycaemic response, fermentation kinetics; Exercise physiology and feeding strategies for sport horses; Nutritionally induced and metabolic disorders, and neutraceuticals; and how that knowledge relates to other fields, disciplines or practices"
null;null;null;null;Farriery II;FAR216D;12;"Students are capacitated with detailed knowledge of horse husbandry principles and practice specific to the field of equine hoof care and principles of horseshoeing. Students will acquire knowledge, skills and applied competencies in areas such as: The history of horseshoeing and the evolution of modern farriery practices; Anatomy and physiology of the distal equine fore- and hind limb; Pathology of the equine foot; Farriery tools, equipment and horseshoeing accessories; Types of horseshoes, shoe-making and styles of horseshoeing; The practice of trimming and the principles of horseshoeing; and how that knowledge relates to other fields, disciplines or practices."
null;null;null;null;Mare and Foal Management II;MFM216D;12;"Students are capacitated with a detailed knowledge of equine stable management and horse husbandry principles and practice. Students will acquire knowledge, skills and applied competencies in areas such as: Mare reproductive biology and endocrinology; Broodmare selection practices; Mare infertility; Natural and assisted reproductive techniques; Parturition, dystocia and care of the neonatal foal; Managing the weanling, yearling and the lactating mare; and how that knowledge relates to other fields, disciplines or practices"
null;null;null;null;Stallion Management II;STM216D;12;"Students are capacitated with a detailed knowledge of equine stable management and horse husbandry principles and practice. Students will acquire knowledge, skills and applied competencies in areas such as: Stallion reproductive biology and semen evaluation; Stallion selection practices and applied theories; Stallion infertility and impotency; Stallion management protocols for reproductive efficiency and welfare of breeding stock; Breeding methods and procedures; Semen preservation techniques and protocols for transportation; and how that knowledge relates to other fields, disciplines or practices."
null;null;null;3;WIL in Equine Sciences I;WEQ306D;120;"A scientific body of knowledge within an international, but mainly in a South African context; and how that knowledge relates to other fields, disciplines or practices. Upon completion of the module, the student will be able to function in a working environment, which can include equine breeding operations, competitive and/ or instructional stable yards, ecotourism and equine health care facilities as well as research or any relevant work environment associated in the cognitive field."
null;null;DIPLOMA IN BIOTECHNOLOGY;1;Communication for Academic Purposes;11P105X;10;A workable knowledge of English is an essential skill for any graduate who is required to conduct themselves successfully in a professional working environment. This module will equip students with the competencies required to compose a selection of written texts related to communicating both internally and externally within a professional environment. In addition, the module includes strategies that are essential for the effective communication in various situations, including small groups to avoid unproductive conflict, a multicultural context, etc.
null;null;null;null;Chemistry I;CHM105X;24;The role and importance of chemistry in everyday life. Classification and properties of matter. Units of measurement. Atoms, molecules and ions. The modern view of atomic structure and the use of electron configurations in chemical bonding. The periodic table of elements. The use of IUPAC rules for naming inorganic compounds. Application of the mole concept in stoichiometric calculations. Reactions in aqueous solutions. Chemical equilibrium. Fundamental concepts in electrochemistry. Organic nomenclature. (
