University;Faculty;Qulification;Year;Modules;Module Code;SAQA credits;Description
Tshwane University of Technology;Science;ANIMAL SCIENCES;1;Communication for Academic Purposes;11P105X;10;You'll learn how to write in a formal tone and politely address your reader, whether it is a professor or peer. In addition to developing high-level communication skills, you might also learn about academia-specific topics, such as how to format a paper to Modern Language Association standards.
null;null;null;null;Animal Anatomy and Physiology I;AAA105D;24;It is a study of the structure and function of the human body including cells, tissues and organs of the following systems: integumentary, skeletal, muscular, nervous.
null;null;null;null;Computer Literacy;CPL105X;10;The course specifically looks at the Microsoft Office suite as the office automation application of choice and introduces you to Word, Excel and the Windows operating system in general to develop practical skills in the use of these software packages.
null;null;null;null;Information Literacy I;INI125D;2;Information Literacy I introduces students to the concept of strategic exploration of a research topic. This dedicated session of information literacy instruction helps students learn to match their information needs to appropriate source types and the search tools to find those sources.
null;null;null;null;Life Skills I;LFI125X;2;Demonstrate knowledge and understanding of the principles and concepts of emotional intelligence in respect of life and work relations.
null;null;null;null;Mathematics and Statistics I;MAS105X;12;This course provides students with decision theory, estimation, confidence intervals, and hypothesis testing. It introduces large sample theory, asymptotic efficiency of estimates, exponential families, and sequential analysis.
null;null;null;null;Science for Occupational Purpose I;SOR105D;12;It studies the things people do in their everyday lives and how those occupations influence and are influenced by health and well-being. Occupational science research includes exploration of the relationship between occupation and development, and how occupation changes over the life course.
null;null;null;null;Entrepreneurship I;ENT115D;12;This course explores all aspects of the creation of a new venture from idea through startup, growth, and beyond. Students will learn how to evaluate opportunities, develop strategies, create a business plan and acquire financing for a new venture.
null;null;null;null;Pasture Science I;PAE115D;12;This degree offers students the knowledge and skills needed to be competent in the livestock industry. Pasture Science refers to the ability to maximise production of animal products {meat, wool etc} without having a negative impact. The different institutions below offer bachelor in Pasture Science degrees.
null;null;null;null;Animal Breeding and Genetics I;ANT115D;12;An MScAgric in Animal breeding and genetics offers students the opportunity to investigate livestock populations on either quantitative or molecular level. It combines population genetics and genetic improvement of livestock to improve the efficiency of production in farm animals.
null;null;null;1;Beef Production II;BPA206D;24;In this course, you'll use a combination of readings, educational videos, and handouts to learn about the basics of beef cattle production.
null;null;null;null;Dairy Production II;DPA206D;24;Branch of agriculture that encompasses the breeding, raising, and utilization of dairy animals, primarily cows, for the production of milk and the various dairy products processed from it.
null;null;null;null;Poultry Production II;PDN206D;24;To provide both women and men with sufficient information and knowledge to allow them to farm poultry in a commercial and semi-commercial way
null;null;null;null;Small Stock Production II;SSA206D;24;This course is aimed at experienced as well as aspiring small stock farmers, covering both sheep and goats.
null;null;null;null;Pig Production II;VPA206D;24;"The pork production sequence can be divided into five phases; mating, gestating, farrowing, nursery and growing-finishing. Animals have specific needs at each of these stages, requiring appropriate husbandry and facilities to insure that they receive p roper attention and care."
null;null;null;3;WIL in Animal Production;WAP306D;120;It will equip students with focused knowledge and skills in primary agricultural animal production. During the course, students can specialise in small stock management (sheep or goat) or large stock management (cattle).
null;null;BACHELOR OF NURSING;1;General Anatomy I;GA1115P;12;"This course provides a comprehensive study of the anatomy and physiology of the human body. Topics include body organization; homeostasis; cytology; histology; and the integumentary, skeletal, muscular, nervous systems and special senses."
null;null;null;null;General Physiology I;GPY115P;12;Students are expected to learn the basic principles and concepts of human physiology both at the molecular and cellular levels, to learn to reason scientifically, and to understand and describe the cooperative function of multiple organ systems in the human body.
null;null;null;null;Nursing Ethos and Professional Practice I;NRE115P;6;The aim of this course is to develop professional nurses to practice within professional, ethical and legal parameters. “Students accepted for the short course can apply for exemptions - RPL in one of the Post Graduate Diplomas: Nursing for the subject that this short course deals with.
null;null;null;null;General Anatomy II;GA2116P;12;Topics include the endocrine system, cardiovascular system, lymphatic and immune system, respiratory system, digestive system, urinary system, reproductive system, and fluid, electrolyte and acid/base balance.
null;null;null;null;General Microbiology;GMB115P;6;Topics include the various groups of microorganisms, their structure, physiology, genetics, microbial pathogenicity, infectious diseases, immunology, and selected practical applications.
null;null;null;null;Introduction to Pharmacology in Nursing;IPN115P;6;PHARMACOLOGY is the study of drugs and their effects on the body. PRECAUTIONS refer to actions that should be employed when medications are prescribed that can cause adverse effects in specific populations or with other drugs or foods.
null;null;null;2;Education and Management in Nursing I;EMN216P;6;It is a leadership role in a given healthcare setting. This strategic management of staff, patients, and facilities is done by implementing policies written by the nurse administrator or senior staff.
null;null;null;null;General Physiology II;GPY216P;12;General Physiology II is the science of the function of living systems which includes how organisms, organ systems, organs, cells and bio- molecules carry out the chemical or physical functions that exist in a living system.
null;null;null;null;Parasitology I;PSL215P;6;Identify clinical signs, symptoms, treatment and epidemiology associated with human parasitic disease. Examine specimen collection and transportation. Explore laboratory methods used to detect and identify parasites.
null;null;null;null;Introduction to Research I;RNS216P;6;"To improve students' understanding of the concepts related to research methodology; to improve the students' ability to communicate ideas about science, including a significant amount of writing; and survey of both quantitative and qualitative research methods."
null;null;null;null;Applied Pharmacology Nursing II;APN216P;6;Pharmacology for Nursing II extends the core pharmacological principles presented in Pharmacology for Nursing 1. This course examines the nurses' role in the administration of more complex drugs and more sophisticated routes of administration.
null;null;null;null;Health Information Management II: Data Analysis;HIM216P;6;The curriculum focuses on health care management, data and information management practices, health information systems and technology
null;null;null;null;Introduction to Midwifery;IMW216P;6;This course will cover several concepts associated with midwifery, including the history of the profession, how to become a midwife and how to practise as a midwife. This online course provides students with a comprehensive training programme that allows them to study whenever and wherever is convenient.
null;null;null;null;Nursing Ethos and Professional Practice II;NRE216P;6;A professional practice model describes how registered nurses practice, collaborate, communicate, and develop professionally to provide the highest-quality care for those served by the organization.
null;null;null;3;Health Information;HIM317P;6;This course will provide an overview of information technology including system analysis and design, data and network management, and information systems architecture and how each directly impacts clinical healthcare personnel.
null;null;null;null;Nursing Ethos and Professional Practice III;NRE317P;6;The primary purpose of this qualification is to develop the intellectual and practical competencies of the qualifying student and to facilitate them
null;null;null;null;Research II: Research Methodology in Nursing;RNS317P;6;This course introduces you to research methods and their application across liberal and professional studies as preparation for lifelong inquiry. Emphasis is on qualitative and quantitative research approaches, experimental design, sampling, measurement, analysis, ethics in research, and research communication.
null;null;null;null;Education and Management in Nursing II;EMN317P;6;It is a leadership role in a given healthcare setting. This strategic management of staff, patients, and facilities is done by implementing policies written by the nurse administrator or senior staff.
null;null;null;null;Pharmacology in Nursing III: Midwifery and Specifics;PMF317P;6;This module introduces student prescribers to the core discipline of Pharmacology. The initial block of lectures covers the concepts of mechanism of drug action.
null;null;null;4;"Nursing Ethos and Professional
Practice IV";NRE418P;6;The aim of this course is to develop professional nurses to practice within professional, ethical and legal parameters. “Students accepted for the short course can apply for exemptions - RPL in one of the Post Graduate Diplomas: Nursing for the subject that this short course deals with.
null;null;null;null;Pharmacology in Nursing IV: Dispensing;PDS418P;12;Pharmacology is the study of the actions of drugs, incorporating knowledge from other sciences. Drugs are classified based on their action or effect on the body or by their chemical characteristics.
null;null;null;null;Education and Management in Nursing III;EMN418P;6;It is a leadership role in a given healthcare setting. This strategic management of staff, patients, and facilities is done by implementing policies written by the nurse administrator or senior staff.
null;null;null;null;Health Information Management IV;HIM418P;6;This course is designed to be an advanced study of methods and techniques to manage health care data with primary focus on electronic records. Topics include healthcare databases, documentation guidelines and evaluation of compliance with regulations and standards.
null;null;HEALTH SCIENCE IN CLINICAL TECHNOLOGY;1;Chemistry for Health Sciences I;CHS115P;12;The course is designed to show the centrality of chemistry between the physical and life sciences. Topics covered will include measurement and unit conversion, atomic and molecular structure of matter, solutions, acid/base chemistry, organic chemistry and structure of proteins, carbohydrates, and fats.
null;null;null;null;Physics for Health Sciences I;PHS115P;12;This introductory course explores mechanics, waves, fluids, thermodynamics, electromagnetism, optics, and assorted topics in modern physics.
null;null;null;null;Research Principles I;RPL115P;6;To provide students with an understanding of the basic research skills for topics related to the construction industry and construction project
null;null;null;null;"Medical Law, Bio-Ethics and
Human Rights I";MBH115P;9;The course aims to develop capacity and excellence in the ethical & legal analysis of issues arising in health care and research.
null;null;null;2;Biomedical Apparatus II;BAP206P;18;Biomedical/medical devices are instruments, machines, implants, in vitro reagents, software, materials, or other related articles that are purposed for the safe and effective prevention, diagnosis, treatment, and rehabilitation of illness and disease for human beings.
null;null;null;null;Clinical Science Practice II;CLC206P;12;The programme aims to develop a sound knowledge of the medical and clinical sciences
null;null;null;null;Clinical Professional Practice II;CLP206P;12;This unit builds on students' understanding of the role of the pharmacist in providing healthcare services to different patient groups. Students will learn the fundamentals of dispensing prescriptions and medication counselling and further develop essential skills for pharmacy practice including communication skills.
null;null;null;null;Human Anatomy II;HAN206P;18;The second of two Anatomy and Physiology courses advances your knowledge of structure, function and interdependence of human body systems. Learn about the endocrine, circulatory, immune, respiratory, digestive, excretory and reproductive systems.
null;null;null;null;Human Physiology II;HPY206P;18;Topics include the endocrine system, cardiovascular system, lymphatic and immune system, respiratory system, digestive system, urinary system, reproductive system, and fluid, electrolyte and acid/base balance.
null;null;null;null;Pharmacology II;PMY206P;18;This unit consolidates your pharmacology knowledge and skills. You will investigate the mechanisms of action of therapeutic drugs used to manage disorders, conditions and diseases involving the central nervous, reproductive, gastrointestinal and endocrine systems.
null;null;null;null;Pathophysiology II;PTS206P;18;This course focuses on the pathophysiology of the human nervous, endocrine, gastrointestinal, and reproductive systems. Common mechanisms of pathogenesis are examined, including injury, autoimmunity, and neoplasia.
null;null;null;null;Medical Law, Bio-Ethics and Human Rights II;MBH216P;9;The course aims to develop capacity and excellence in the ethical & legal analysis of issues arising in health care and research.
null;null;null;null;Research Principles II;RPL216P;6;To provide students with an understanding of the basic research skills for topics related to the construction industry and construction projects
null;null;null;3;Clinical Professional Practice III;CLP307P;12;This course will provide opportunity to extend nursing practice in caring for patients in high acuity settings.
null;null;null;null;Health Care Administration and Management I;HAM307P;12;This course addresses challenges faced in healthcare administration and potential solutions using practical approaches. Topics include strategy, culture, managerial, and strategic issues facing healthcare organizations.
null;null;null;null;Medical Law, Bio-Ethics and Human Rights III;MBH317P;9;The course aims to develop capacity and excellence in the ethical & legal analysis of issues arising in health care and research.
null;null;null;null;Research Principles III;RPL307P;6;The course introduces the language of research, ethical principles and challenges, and the elements of the research process within quantitative and  qualitative
null;null;null;4;Clinical Education and Mentoring I;CDG408P;12;This module focuses on mentoring and coaching in relation to the purposes, context, processes, skills and impact on the clinical learning
null;null;null;null;Clinical Professional Practice IV;CLP408P;12;The unit introduces the key concepts of evidence-based practice, including those related to retrieving, appraising and applying research evidence as the basis for clinical decision making. The unit covers both a systems-based and patient-centred approaches to the development and delivery of clinical services.
null;null;null;null;Health Care Administration and  Management II;HAM408P;12;This course addresses challenges faced in healthcare administration and potential solutions using practical approaches.
null;null;null;null;Medical Law, Bio-Ethics and  Human Rights IV;MBH418P;9;The aim of the course is to train bioethics and medical law experts who will display skill and proficiency in the fields of bioethics & health law.
null;null;null;null;Pathophysiology IV;PTS418P;12;This course relates the knowledge of anatomy and physiology to the disruptions in homeostasis resulting in a disorder or disease process. Processes employed by the body in response to disruptions of homeostasis are examined.
null;null;null;null;Research Principles IV and Project;RPL408P;30;"Research Principles IV and
Project"
null;null;HEALTH SCIENCE IN MEDICAL LABORATORY SCIENCE;1;Chemistry for Health Sciences;CHI115P;12;The course is designed to show the centrality of chemistry between the physical and life sciences. Topics covered will include measurement and unit conversion, atomic and molecular structure of matter, solutions, acid/base chemistry, organic chemistry and structure of proteins, carbohydrates, and fats.
null;null;null;null;Foundation Life Skills;FLF125P;2;The purpose of assessment of Life Skills during the Foundation Phase is to assess the development of knowledge, concepts, skills and values that will help to prepare the Foundation Phase learner for more formal assessment during the Intermediate Phase.
null;null;null;null;Physics for Health Sciences I;PHS115P;12;This introductory course explores mechanics, waves, fluids, thermodynamics, electromagnetism, optics, and assorted topics in modern physics.
null;null;null;null;Research Principles I;RPN115P;6;To provide students with an understanding of the basic research skills for topics related to the construction industry and construction project
null;null;null;null;Cell Biology I;CBI115P;12;"In this course we will examine many different areas of cellular biology including: the synthesis and function of macromolecules such as DNA, RNA, and proteins; control of gene expression; membrane and organelle structure and function; bioenergetics; and cellular communication."
null;null;null;null;Immunology I;IMM115P;12;In addition to establishing the workings of a healthy immune system, the course will also address what underlies situations of inappropriate or insufficient immunity, such as allergy, autoimmunity and immune deficiency.
null;null;null;null;Medical Laboratory Science I;MLS115P;12;Laboratory Sciences programme is to produce graduates competent to apply theoretical and practical fundamental knowledge and skills in the fields of medical science and research.
null;null;null;null;Clinical Chemistry II;CCI206P;24;Topics include clinical enzymology, liver and cardiac function, iron metabolism, diabetes, lipid metabolism and other specialised clinical biochemistry tests.
null;null;null;null;Microbiology I;MBY216P;12;Our BSc Microbiology course involves the study of microorganisms with particular emphasis on the biology of bacteria, viruses, fungi and protozoan parasites.
null;null;null;null;Medical Laboratory Science II;MLS216P;6;Medical laboratory science is the use of clinical laboratory tests to detect, diagnose, monitor and treat disease. Blood, tissue and body fluids can be chemically analyzed and examined for foreign organisms and abnormalities.
null;null;null;null;Histology II;HST216P;12;Histology is the study of microscopic anatomy and is a vital tool in modern healthcare and many research environments. In this course students will be introduced to normal and abnormal microscopic anatomy of human tissues.
null;null;null;null;Immunohaematology II;IHM216P;12;This course presents advanced immunohematology principles and techniques in preparation for practice in the clinical blood bank laboratory.
null;null;null;null;Medical Microbiology II;MMI216P;12;This course illustrates structures and functions of bimolecules which includes carbohydrates, proteins, lipids, nucleic acids, enzymes and hormones. In the practical part of this course, students study the detection and quantitative determination of some of these biomolecules.
null;null;null;null;Research Principles II;RPN216P;6;This course illustrates structures and functions of bimolecules which includes carbohydrates, proteins, lipids, nucleic acids, enzymes and hormones. In the practical part of this course, students study the detection and quantitative determination of some of these biomolecules.
null;null;null;3;Clinical Chemistry III;CCI317P;12;Upon completion of this course, the student will demonstrate knowledge of: the principles and clinical applications of various photometric techniques an instrumentation, including spectrophotometry, atomic absorption photometry, fluorometry, chemiluminescence, turbidimetry, and nephelometry.
null;null;null;null;Haematology III;HTY317P;12;The Clinical Hematology course will cover the diagnosis and management of blood cell disorders, anatomy and physiology of hematopoiesis, routine specialized hematology tests, analysis, classification, and monitoring of blood cell abnormalities.
null;null;null;null;Integrated Cytology and Histology III;ICH317P;12;Cytology is the study of the cellular components. The objectives of this part of the course are to enable students to establish links between the morphology
null;null;null;null;Integrated Pathophysiology III;IPY317P;12;This course provides students with the opportunity to integrate existing scientific knowledge (anatomy, physiology, biochemistry, pharmacology and microbiology) with emerging empiric knowledge while developing an understanding of the complex pathophysiological mechanisms contributing to altered health states.
null;null;null;null;Medical Microbiology III;MMI317P;12;On completion of this course, the student will be able to: Know the microorganisms and parasites that can cause disease in human beings, including virulence mechanisms and the epidemiology of infections.
null;null;null;null;Clinical Laboratory Practice III;CLR317P;60;Course is designed to allow students to develop the skills, knowledge, and attitude required to function in a professional manner in the clinical laboratory
null;null;null;4;Diagnostic Laboratory Management IV;DLG418P;12;This subject will cover the following topics:  Professionalism, workforce and ethics, Communication, Management of resources, Management and leadership
null;null;null;null;Research Principles IV and Project;RPN408P;30;The course will introduce students to research principles and methods.
null;null;HEALTH SCIENCE IN VETERINARY TECHNOLOGY;1;Animal Anatomy I;ANM115P;12;Learn about animal biology, function in the body and structure from bones to soft tissues.
null;null;null;null;Animal Physiology I;ANP115P;12;Animal physiology is the study of how animals work. In this course, we will learn about the structures and functions that allow animals to adapt and survive in different ecosystems around the world.
null;null;null;null;Chemistry for Health Science I;CHC115P;12;The course is designed to show the centrality of chemistry between the physical and life sciences. Topics covered will include measurement and unit conversion, atomic and molecular structure of matter, solutions, acid/base chemistry, organic chemistry and structure of proteins, carbohydrates, and fats.
null;null;null;null;Physics for Health Sciences I;PHS115P;12;This introductory course explores mechanics, waves, fluids, thermodynamics, electromagnetism, optics, and assorted topics in modern physics.
null;null;null;null;Microbiology I;MBL115P;12;Our BSc Microbiology course involves the study of microorganisms with particular emphasis on the biology of bacteria, viruses, fungi and protozoan parasites.
null;null;null;null;Research Principles I;RPV115P;6;To provide students with an understanding of the basic research skills for topics related to the construction industry and construction project
null;null;null;null;Biochemistry II;BCH216P;12;Biochemistry describes in molecular terms the structures, mechanisms, and chemical processes shared by all organisms and provides organizing principles that underlie life in all its diverse forms.
null;null;null;null;Immunology II;IMM216P;12;Immunology course will see you learn about the components, principles and mechanisms of a healthy immune system
null;null;null;null;Microbiology II;MBL216P;12;This course is an introduction to microbiology that provides a strong grounding in fundamental aspects of the basic biology of bacteria
null;null;null;null;Research Principles II;RPV216P;6;The course introduces the language of research, ethical principles and challenges, and the elements of the research process within quantitative, qualitative
null;null;null;null;Veterinary Haematology II;VHT216P;12;Learn the practical application of hematology to companion animal medicine.
null;null;null;null;Histology II;HST216P;12;To acquire a basic background in histology
null;null;null;null;Serology II;SER216P;12;This course is intended to introduce fundamental and important aspects of the various immunological and serological methods used in laboratory diagnosis of disease, with insight into the basic mechanisms and reactions involved in such methods.
null;null;null;3;Clinical Veterinary Technology III in Entomology*;EMY307P;18;This course provides an introduction to the anatomy, physiology, genetics, population biology, diversity and phylogeny
null;null;null;null;Clinical Veterinary Technology III in Helminthology*;HMY307P;18;This course addresses the role of the veterinary technician in managing clinical cases in equine practice.
