University;Faculty;Qulification;Year;Modules;Module Code;SAQA credits;Description
null;null;null;null;Computer Literacy;CPL105X;10;This module provides students with foundational knowledge in computing fundamentals, essential digital skills in key applications based on MS Office Suite and network basics (i.e. MS Outlook and Internet). Online exams are mapped with End-User Computing: SAQA 49077 (61591) Core Element as well as Internet and Computing Core Certification (IC3).
null;null;null;null;General Mathematics I;GMA105D;24;"Do numerical computations. Apply knowledge of mensuration to calculate perimeters, areas and volumes of two- and three-dimensional objects. Apply knowledge of functions and equations to solve well-defined problems. Use basic calculus rules to solve well-defined problems. Use Excel to organise given data in charts and calculate descriptive measures. Do basic regression analysis and curve fitting using Excel and a scientific calculator; and Implement basic probability theories to predict outcomes of events."
null;null;null;null;General Physics I;GPH105D;24;Basic mathematical concepts for physics and measurements. Motion in one dimension. Motion in a plane (projectile motion). Forces and Newton’s Law of Motion. Equilibrium condition and torque. Work, energy and power. Linear momentum and impulse. Properties of static and dynamic fluids. Temperature and heat. Heat transfer. General properties of waves. Reflection. Refraction. Electrostatics. Electric circuits. Basic nuclear physics.
null;null;null;null;Information Literacy I;INI125D;2;Introduction of information literacy. Development of a search strategy and application of a search string to search engines and academic databases. Evaluation of information sources. Ethical and legal use of information.
null;null;null;null;Life Skills I;LFI125X;2;"Personal, socio-emotional and academic skills development for students in higher education. This module includes: 1. Intra- and interpersonal skills (e.g. emotional intelligence, relationships, and conflict management); 2. General study skills (e.g. time management, goal setting, learning styles); 3. Health and wellness (e.g. HIV/ AIDS, GBV issues, substance abuse); 4. Student life and adjustment (e.g. identity development, adjusting to a higher education environment); and 5. Financial management"
null;null;null;null;Microbiology I;MIB105D;24;History and scope of Microbiology. The study of microbial structure. Prokaryotic cell structure and function. Microbial nutrition. Microbial growth. The control of microorganisms by physical and chemical agents. Viruses and other acellular agents. Infection and pathogenicity. Eukaryotic cell structure and function. Fungi. Protists. Microbiology of air
null;null;null;2;Bioanalytical Chemistry II;BAC216D;12;Introduction to Bioanalytical Chemistry. The role and importance of analytical chemistry in everyday life. Perform analytical chemistry calculations. Calculate the amount required to prepare accurate concentrations of solutions. Apply titration method to quantify the content of acid or a base. Apply appropriate procedure to determine unknown analyte quantity in a given sample. Identify and explain the functions of the components of spectrophotometer and chromatographic instrument. Apply the fundamental laws of photometry to solve spectroscopic problems. Separate and identify analytes by applying appropriate chromatographic principles. Compile and present report
null;null;null;null;Biochemistry II;BCH216D;12;The Organisation of a cell. Molecular structure of amino acids and proteins. Enzyme Kinetics. Carbohydrates. Lipids. Nucleic acids. Reagents, pH and buffers.
null;null;null;null;Process Technology and Management I;PEM216D;12;Units, dimensions and definitions. Material balances. Energy and Energy balances. Steam and Steam tables. Psychrometrics. Fluid flow and properties.
null;null;null;null;Biotechnology Cultivation Technology II;BCT216D;18;Isolation of Microorganisms. Microbial growth. Screening of microorganisms. Setting up a fermentation laboratory – Instrumentation. Bioreactors. pH and dissolved oxygen sensors. Sterilisation. Inoculum development. Fed batch and continuous cultures. Product recovery. Fermentation economics.
null;null;null;null;Microbial Biochemistry II;MBC216D;12;The module prepares the student to apply fundamental and specialised knowledge of biological chemistry in the field of biotechnology. The student will be able to apply his/her knowledge of structural biochemistry, metabolism of carbohydrates, proteins and lipids, as well as photosynthesis. This module offers a clear understanding of microbial metabolism and behaviour, central to proper functioning in a biotechnology field, ensuring productivity and skilful resolution of problems.
null;null;null;null;Microbial Taxonomy II;MBT216D;15;Introduction to microbial taxonomy. Fundamentals of taxonomy including identification, classification and nomenclature. Classification systems. Phylogenetic. Phenetic. Levels of classification. Evolutionary processes and the species concept. The three-domain alternative. The kingdom systems (5 and 7). The concept and definition of microbial species. The groups of techniques applied in taxonomy. The classical characteristics. Ecological. Biochemical, Physiological. Molecular based techniques. Microbial phylogeny. Phylogenetic trees. Molecular markers. Endosymbiotic theory. Bergey's manual.
null;null;null;3;Bioanalytical Chemistry III;BAC316D;12;Calculations in Analytical Chemistry. Introduction to Spectrochemical methods. Atomic Absorption Spectrometry. Molecular Spectrometry. Sample preparation. General principles of Gas Chromatography, general principles of Liquid Chromatography
null;null;null;null;Food Microbiology III;FOM316D;15;Importance of food microbiology, microbial and mycological spoilage of food, factors influencing microbial spoilage of foods will covered including: Microbial growth, survival and death. Spores and their significance. Detection and enumeration of microbes in food. Indicator microorganisms and microbiological criteria. Gram negative foodborne pathogenic bacteria. Gram positive foodborne pathogenic bacteria and other detrimental organisms associated with food. Microorganisms used in fermented foods. Spoilage organisms. Molds. Chemical preservatives.
null;null;null;null;Microbial Bioprocessing III;MBP316D;18;The module introduces the student to Bioprocesses using microorganisms, covering concepts such as beer brewing, using microorganisms to treat sewage, fermented foods, production of amino acids, Single Cell Protein production, microbial enzymes and yeast production. The unit facilitates the student to apply basic knowledge acquired in the fundamental modules to bioprocesses used worldwide through group work, presentations and/ or scientific reports.
null;null;null;null;Medical Microbiology III;MMB316D;15;"Upon completion of the module, the student will be able to define, characterise, discuss and observe factors related to microorganisms, their control, as well as their influence on humans and the environment in the field of medical microbiology (such as infection and pathogenicity of microorganisms, non-specific host resistance, specific immunity, antimicrobial chemotherapy, clinical microbiology, epidemiology of infectious diseases and public health, human diseases caused by: viruses and prions, gram-positive and gram-negative bacteria, other bacteria (chlamydiae, mycoplasmas, rickettsias; dental and nosocomial infections), as well as diseases caused by fungi and protozoa"
null;null;DIPLOMA IN FOOD TECHNOLOGY;1;Communication for Academic Purposes;11P105X;10;A workable knowledge of English is an essential skill for any graduate who is required to conduct themselves successfully in a professional working environment. This module will equip students with the competencies required to compose a selection of written texts related to communicating both internally and externally within a professional environment. In addition, the module includes strategies that are essential for the effective communication in various situations, including small groups to avoid unproductive conflict, a multicultural context, etc
null;null;null;null;Chemistry I;CHM105X;24;The role and importance of chemistry in everyday life. Classification and properties of matter. Units of measurement. Atoms, molecules and ions. The modern view of atomic structure and the use of electron configurations in chemical bonding. The periodic table of elements. The use of IUPAC rules for naming inorganic compounds. Application of the mole concept in stoichiometric calculations. Reactions in aqueous solutions. Chemical equilibrium. Fundamental concepts in electrochemistry. Organic nomenclature.
null;null;null;null;Computer Literacy;CPL105X;10;This module provides students with foundational knowledge in computing fundamentals, essential digital skills in key applications based on MS Office Suite and network basics (i.e. MS Outlook and Internet). Online exams are mapped with End-User Computing: SAQA 49077 (61591) Core Element as well as Internet and Computing Core Certification (IC3).
null;null;null;null;General Mathematics I;GMA105D;24;"Do numerical computations. Apply knowledge of mensuration to calculate perimeters, areas and volumes of two- and three-dimensional objects. Apply knowledge of functions and equations to solve well-defined problems. Use basic calculus rules to solve well-defined problems. Use Excel to organise given data in charts and calculate descriptive measures. Do basic regression analysis and curve fitting using Excel and a scientific calculator; and Implement basic probability theories to predict outcomes of events."
null;null;null;null;General Physics I;GPH105D;24;Basic mathematical concepts for physics and measurements. Motion in one dimension. Motion in a plane (projectile motion). Forces and Newton’s Law of Motion. Equilibrium condition and torque. Work, energy and power. Linear momentum and impulse. Properties of static and dynamic fluids. Temperature and heat. Heat transfer. General properties of waves. Reflection. Refraction. Electrostatics. Electric circuits. Basic nuclear physics.
null;null;null;null;Information Literacy I;INI125D;2;Introduction of information literacy. Development of a search strategy and application of a search string to search engines and academic databases. Evaluation of information sources. Ethical and legal use of information.
null;null;null;null;Life Skills I;LFI125X;2;"Personal, socio-emotional and academic skills development for students in higher education. This module includes: 1. Intra- and interpersonal skills (e.g. emotional intelligence, relationships, and conflict management); 2. General study skills (e.g. time management, goal setting, learning styles); 3. Health and wellness (e.g. HIV/ AIDS, GBV issues, substance abuse); 4. Student life and adjustment (e.g. identity development, adjusting to a higher education environment); and 5. Financial management."
null;null;null;null;Microbiology I;MIB105D;24;History and scope of Microbiology. The study of microbial structure. Prokaryotic cell structure and function. Microbial nutrition. Microbial growth. The control of microorganisms by physical and chemical agents. Viruses and other acellular agents. Infection and pathogenicity. Eukaryotic cell structure and function. Fungi. Protists. Microbiology of air.
null;null;null;null;Food Technology Preservation I;FTP115D;12;Introduction to Food Science and Technology as a discipline. Characteristics of the Food Industry. Constituents of Foods: Properties and Significance. Nutritive Aspects of Food Constituents. Unit Operations in Food Processing. Quality Factors in Foods. Food Deterioration and its Control. Heat Preservation and Processing. Cold Preservation and Processing. Food Dehydration and Concentration. Fermentations and other Uses of Microorganisms. Report Writing and Scientific Referencing. Metric system and formulations conversions
null;null;null;2;Bioanalytical Chemistry II;BAC216D;12;Introduction to bioanalytical chemistry. The role and importance of analytical chemistry in everyday life. Perform analytical chemistry calculations. Calculate the amount required to prepare accurate concentrations of solutions. Apply titration method to quantify the content of acid or a base. Apply appropriate procedure to determine unknown analyte quantity in a given sample. Identify and explain the functions of the components of spectrophotometer and chromatographic instrument. Apply the fundamental laws of photometry to solve spectroscopic problems. Separate and identify analytes by applying appropriate chromatographic principles. Compile and present report
null;null;null;null;Biochemistry II;BCH216D;12;The Organisation of a cell. Molecular structure of amino acids and proteins. Enzyme Kinetics. Carbohydrates. Lipids. Nucleic acids. Reagents, pH and buffers.
null;null;null;null;Food Chemistry II;FCM216D;12;Study of the major chemical components of food, the chemical changes they undergo during processing and storage and methods used to analyse them. Major chemical components include: sugars. Polysaccharides, lipids, proteins, colours, flavours, water, and Laboratory safety and rules. Guidelines for practical report writing.
null;null;null;null;Microbial Taxonomy II;MBT216D;15;Introduction to microbial taxonomy. Fundamentals of taxonomy including identification, classification and nomenclature. Classification systems. Phylogenetic. Phenetic. Levels of classification. Evolutionary processes and the species concept. The three-domain alternative. The kingdom systems (5 and 7). The concept and definition of microbial species. The groups of techniques applied in taxonomy. The classical characteristics. Ecological. Biochemical, Physiological. Molecular based techniques. Microbial phylogeny. Phylogenetic trees. Molecular markers. Endosymbiotic theory. Bergey's manual.
null;null;null;3;Food Industry Management I;FIM316D;12;Introduction to business and its challenges. The business environment. The task of management. Operations management. Logistics management. Financial management. Human resources management. Marketing management. Entrepreneurship. The business plan.
null;null;null;null;Food Microbiology III;FOM316D;15;Importance of food microbiology, microbial and mycological spoilage of food, factors influencing microbial spoilage of foods will covered including: Microbial growth, survival and death. Spores and their significance. Detection and enumeration of microbes in food. Indicator microorganisms and microbiological criteria. Gram negative foodborne pathogenic bacteria. Gram positive foodborne pathogenic bacteria and other detrimental organisms associated with food. Microorganisms used in fermented foods. Spoilage organisms. Molds. Chemical preservatives.
null;null;null;null;Food Process Engineering I;FPE316D;12;Units, dimensions and definitions. Material balances. Energy and Energy balances. Steam and Steam tables. Psychrometrics. Fluid flow and properties.
null;null;null;null;Food Quality Assurance I;FQA316D;15;Introduction to food quality assurance. Quality concepts and terminology. Defining food quality. Customer requirements. Customer feedback and service. Product specifications. Food labelling and shelf life. Good Manufacturing Practices (GMP). HACCP and microbiological control. Managing the organisation. ISO 9000 and ISO 14001. Verification and plant inspection. Continuous improvement.
null;null;DIPLOMA IN CROP PRODUCTION;1;Communication for Academic Purposes;11P105X;10;A workable knowledge of English is an essential skill for any graduate who is required to conduct themselves successfully in a professional working environment. This module will equip students with the competencies required to compose a selection of written texts related to communicating both internally and externally within a professional environment. In addition, the module includes strategies that are essential for the effective communication in various situations, including small groups to avoid unproductive conflict, a multicultural context, etc.
null;null;null;null;Botany I;BOT105D;24;The role of plants in the living world. The plant Kingdom, endemic, indigenous, exotic, history and development. Plant classification. Classification systems. Morphology of higher plants. Seed, roots, stems, leaves, inflorescences, flowers, fruit. Anatomy of higher plants. Plant cells and cellular components, roots, stems and leaves. Plant physiology. Photosynthesis, respiration. Transpiration and water movement in the plant. Transpiration and water movement, mineral uptake and sugar translocation
null;null;null;null;Computer Literacy;CPL105X;10;(Module custodian: End User Computing Unit) This module provides students with foundational knowledge in computing fundamentals, essential digital skills in key applications based on MS Office Suite and network basics (i.e. MS Outlook and Internet). Online exams are mapped with End-User Computing: SAQA 49077 (61591) Core Element as well as Internet and Computing Core Certification (IC3).
null;null;null;null;Information Literacy I;INI125D;2;Introduction of information literacy. Development of a search strategy and application of a search string to search engines and academic databases. Evaluation of information sources. Ethical and legal use of information.
null;null;null;null;Life Skills I;LFI125X;2;"Personal, socio-emotional and academic skills development for students in higher education. This module includes: 1. Intra- and interpersonal skills (e.g. emotional intelligence, relationships, and conflict management); 2. General study skills (e.g. time management, goal setting, learning styles); 3. Health and wellness (e.g. HIV/ AIDS, GBV issues, substance abuse); 4. Student life and adjustment (e.g. identity development, adjusting to a higher education environment); and 5. Financial management."
null;null;null;null;Mathematics and Statistics I;MAS105X;12;Numerical computations, mensuration, equations, functions, descriptive statistics, linear regression and curve fitting.
null;null;null;null;Science for Occupational Purpose I;SOR105D;12;The role and importance of chemistry in everyday life. Classification and properties of matter. Atoms, molecules and ions. General properties of aqueous solutions and reactions in aqueous solutions. Motion. Forces. Energy and power. Density. Pressure. Temperature and heat. Basic Electricity. Basic Magnetism. Waves.
null;null;null;null;Agricultural Economics I;AGE115D;12;Description of the South African agricultural environment. Role-players in the South African agricultural industry.
null;null;null;null;Agricultural Mechanisation I;AGM115D;12;Principles and operation of the basic power units applicable to agriculture.
null;null;null;null;Crop Production I;CPR115D;12;An introduction to crop production. Factors influencing the adaptability of crops. The principles of different cultivation practices and crop improvement. Calculations regarding planting dates, crop potential, fertilisation, plant population, yields, calibration of implements.
null;null;null;null;Crop Protection I;CPT115D;12;Basic entomology: a review of the morphology, development, reproduction, biology and classification of insects and mites, and collection and mounting of insect specimens. Plant pathology: a review of symptoms and the classification of plant diseases, the classification and biology of the different groups of plant pathogens, the disease cycle, the dissemination of plant pathogens. A review of the biology of weeds and methods of weed control: chemical weed control regarding classification, choice and the effectivity of herbicides.
null;null;null;null;Soil Science I;SOS115D;12;Basic principles of chemistry: a basic introduction to the structure of an atom and the properties of the periodic table, including the naming of inorganic compounds, properties and the influence of soil pH on nutrient availability with special emphasis on the sources and properties of different fertilisers used.
null;null;null;2;Crop Protection II;CPT206D;24;Pest control: a review of various pesticides, the use of standard reference material, a review of various pest control methods, the biology and control of known South African agricultural pests. Disease control: a review of different disease management strategies, separation of host and pathogen, cultural control, biological control, physical control, immunisation and resistance, and chemical control, with appropriate examples. Pathogen resistance: mechanisms of resistance and management of resistance. Application: a review of the different types of application equipment and the principles of application, and calibration of application equipment, with appropriate examples. Legislation and the safe use of agrochemicals: discussion of Fertilizers, Farm Feeds, Agricultural Remedies and Stock Remedies Act, 1947 (Act No. 36 of 1947) and Hazardous Substances Amendment Act, 1992 (Act No. 53 of 1992) and various other important agricultural laws relating to pest control, a review of the safe use of agrochemicals.
null;null;null;null;Field Crops II;FLC206D;21;Introduction to the industry of field crops. Cultural practices. Climatic requirements of field crops. Alternative field crops. Classification of field crops. Harvesting of field crops. Yield, quality and its maintenance. Sunflower production. Soya bean production. Potato production. Lucerne production.
null;null;null;null;Fruit Production II;FRP206D;21;An introduction to the South African fruit industry and the classification of the fruit. Important climatic factors for fruit production. Establishment and maintenance of the orchard. Structure growth development and production of tree fruit, maturity indices for harvesting, basics of harvesting, field handling and determining the fruit quality parameters with an emphasis of popular temperate fruit.
null;null;null;null;Soil Science II;SOS206D;21;Part A: Plant nutrients. Microorganisms and plant nutrition. Fertiliser recommendations. Irrigation. Part B: Soil forming processes. Soil classification. Soil surveys. Land capability and its assessment. Farm planning.
null;null;null;null;Vegetable Production II;VGP206D;21;Vegetable production planning. Vegetable classification. Seed quality and germination. Seed treat-ments and manipulation. Soil preparation. Seedling production. Transplanting. Vegetable production systems. Fertilisers and fertigation. Irrigation and mulching. Vegetable production under protection. Vegetable crop rotation, hygiene, and crop protection. Quality and marketing management. Vegetable production (Tomato, beetroot, lettuce, cabbage, onions and pumpkins)
null;null;null;3;WIL in Crop Production I;WCP306D;120;A practical internship of one semester at an approved agriculture-related enterprise. A report on the internship, as well as tasks relating to the specialisation field of the student. An oral examination is taken at the end of the period.
null;null;DIPLOMA IN ENVIRONMENTAL SCIENCES;1;Applied Environmental Practice I;AEP115D;6;Essay writing. Site visit. Mapping and geographical positioning system.
null;null;null;null;Environmental Biology I;EVB115D;6;Terrestrial and aquatic ecosystems. Functioning and importance of ecosystems. Threats to ecosystems. Biomes of South Africa. South Africa’s flora. South Africa’s fauna.
null;null;null;null;Environmental Earth Studies I;EVE115D;6;Understand how the earth was formed. Know the solar system. Discuss the origin and function of the earth’s magnetic field. Understand observations that led to the theory of plate tectonics. Discuss tectonic activities at different plate boundaries and how the impact on the different components of the environment i.e. hydrosphere, lithosphere, biosphere and atmosphere. Relate formation of sedimentary, igneous and metamorphic rocks to the different plate tectonics processes. Identify different minerals in hand specimen. Classify minerals on the basis of their chemistry. Relate chemistry of minerals to the impact they are likely to have on the environment.
null;null;null;null;Environmental Management I;EVM115D;6;Air pollution. Climate change. Water pollution. Renewable Energy. Human Population and Impacts on the environment. Sustainable cities.
null;null;null;2;Applied Environmental Practice II;AEP206D;20;"Scientific report writing. Learn to select appropriate tools and techniques in creating or editing graphics within a
guided environment. Demonstrate detailed knowledge of and the ability to use the key terms, concepts, facts,
principles, theories of how remote sensing works. Distinguish between possible areas of specialisation within
the field of remote sensing and understand how remote sensing can be used in environmental monitoring and
geographical information systems (GIS). Detailed knowledge and the ability to apply key terms, concepts, facts,
principles, rules and theories in the field of geographical information systems and an understanding of how it is
related to other closely related fields like geology, town planning, botany, hydrology and climatology. Evaluate
a geospatial problem, select and apply appropriate geographic information system (GIS) methods, procedures
and techniques to identify and apply geospatial analysis. Demonstrate the ability to identify, analyse and solve
problems in unfamiliar contexts like a site visit to a greenfields or brownfields site where a development is
proposed to occur, gathering relevant evidence of the current biotic and abiotic environmental conditions and
applying baseline assessment procedures to make informed recommendations on how the development should
be managed."
